{
  "review_status": "approve-with-notes",
  "goal": "Review a wallet session refactor for safety and maintainability",
  "scope": [
    "lib/services/wallet_session_store.dart",
    "test/services/wallet_session_store_test.dart"
  ],
  "findings": [
    {
      "severity": "low",
      "file": "lib/services/wallet_session_store.dart",
      "issue": "Error-path comments are still sparse around invalid session payload decoding",
      "required_action": "Add a short comment or rename helper methods if the decode path changes again"
    }
  ],
  "strengths": [
    "Behavior remained test-backed",
    "Serialization logic is more centralized"
  ],
  "verification_gaps": [
    "No device-level wallet restore validation was run"
  ]
}
